time,ip,controller,order,inner,label,square,pennelement_type,pennelement_name,parameter,value,event_time,id,text,mod,lin,syn,dupl,comments
1734530918,937baeae001819baa0b9fcab15e11306,PennController,30,0,experiment,NULL,Scale,judgement,Choice,7,1734531164654,undefined,У всех нас недавно произошло трагическое событие.,vse,L,high,False,NULL
1734530918,937baeae001819baa0b9fcab15e11306,PennController,9,0,experiment,NULL,Scale,judgement,Choice,5,1734531175288,undefined,Я никогда раньше не был у него у больного.,depic,R,low,True,NULL
1734530918,937baeae001819baa0b9fcab15e11306,PennController,16,0,experiment,NULL,Scale,judgement,Choice,5,1734531179249,undefined,У него теперь у самого почти нет денег.,sam,E,high,True,NULL
1734530918,937baeae001819baa0b9fcab15e11306,PennController,6,0,experiment,NULL,Scale,judgement,Choice,5,1734531182668,undefined,Мы уже бывали в гостях у них у всех.,vse,R,low,True,NULL
1734530918,937baeae001819baa0b9fcab15e11306,PennController,7,0,experiment,NULL,Scale,judgement,Choice,5,1734531188148,undefined,Не волнуйся%2C он это спрашивал у нас у каждого.,kazhdy,R,low,True,NULL
1734530918,937baeae001819baa0b9fcab15e11306,PennController,10,0,experiment,NULL,Scale,judgement,Choice,5,1734531195756,undefined,У всех у нас сегодня очень интересные доклады.,vse,L,high,True,NULL
1734530918,937baeae001819baa0b9fcab15e11306,PennController,8,0,experiment,NULL,Scale,judgement,Choice,2,1734531216847,undefined,Я узнал все детали у нее у самой.,sam,R,low,True,NULL
1734530918,937baeae001819baa0b9fcab15e11306,PennController,28,0,experiment,NULL,Scale,judgement,Choice,6,1734531225837,undefined,Она мечтала обо всем спросить у него самого.,sam,R,low,False,NULL
1734530918,937baeae001819baa0b9fcab15e11306,PennController,34,0,experiment,NULL,Scale,judgement,Choice,1,1734531230416,undefined,У нас недавно всех произошло трагическое событие.,vse,E,high,False,NULL
1734530918,937baeae001819baa0b9fcab15e11306,PennController,26,0,experiment,NULL,Scale,judgement,Choice,6,1734531234297,undefined,Он одолжил денег у них всех.,vse,R,low,False,NULL
1734530918,937baeae001819baa0b9fcab15e11306,PennController,3,0,experiment,NULL,Scale,judgement,Choice,6,1734531248281,undefined,У нас у каждого сегодня есть чем поделиться.,kazhdy,R,high,True,NULL
1734530918,937baeae001819baa0b9fcab15e11306,PennController,14,0,experiment,NULL,Scale,judgement,Choice,6,1734531252137,undefined,У нас сегодня у всех очень интересные доклады.,vse,E,high,True,NULL
1734530918,937baeae001819baa0b9fcab15e11306,PennController,15,0,experiment,NULL,Scale,judgement,Choice,6,1734531258150,undefined,У нас сегодня у каждого есть чем поделиться.,kazhdy,E,high,True,NULL
1734530918,937baeae001819baa0b9fcab15e11306,PennController,24,0,experiment,NULL,Scale,judgement,Choice,7,1734531262590,undefined,У меня самого сейчас возникли вопросы к организаторам этого мероприятия.,sam,R,high,False,NULL
1734530918,937baeae001819baa0b9fcab15e11306,PennController,18,0,experiment,NULL,Scale,judgement,Choice,5,1734531268453,undefined,Мы у них уже бывали в гостях у всех.,vse,E,low,True,NULL
1734530918,937baeae001819baa0b9fcab15e11306,PennController,27,0,experiment,NULL,Scale,judgement,Choice,1,1734531275710,undefined,Она проверила домашнее задание у нас каждого.,kazhdy,R,low,False,NULL
1734530918,937baeae001819baa0b9fcab15e11306,PennController,41,0,experiment,NULL,Scale,judgement,Choice,2,1734531391923,undefined,Я каждый раз прошу у него помощи уставшего.,depic,E,low,False,NULL
1734530918,937baeae001819baa0b9fcab15e11306,PennController,21,0,experiment,NULL,Scale,judgement,Choice,4,1734531397659,undefined,Я у него никогда раньше не был у больного.,depic,E,low,True,NULL
1734530918,937baeae001819baa0b9fcab15e11306,PennController,20,0,experiment,NULL,Scale,judgement,Choice,2,1734531401860,undefined,Я узнал у нее все детали у самой.,sam,E,low,True,NULL
1734530918,937baeae001819baa0b9fcab15e11306,PennController,40,0,experiment,NULL,Scale,judgement,Choice,2,1734531441137,undefined,Она мечтала у него обо всем спросить самого.,sam,E,low,False,NULL
1734531454,5d0ae46a3921b8a231566119af0b8362,PennController,26,0,experiment,NULL,Scale,judgement,Choice,5,1734531274146,undefined,Мы уже бывали в гостях у них всех.,vse,R,low,False,NULL
1734531454,5d0ae46a3921b8a231566119af0b8362,PennController,13,0,experiment,NULL,Scale,judgement,Choice,6,1734531280092,undefined,И у больного у него часто получается лучше%2C чем других.,depic,L,high,True,NULL
1734531454,5d0ae46a3921b8a231566119af0b8362,PennController,27,0,experiment,NULL,Scale,judgement,Choice,4,1734531284099,undefined,Не волнуйся%2C он это спрашивал у нас каждого.,kazhdy,R,low,False,NULL
1734531454,5d0ae46a3921b8a231566119af0b8362,PennController,22,0,experiment,NULL,Scale,judgement,Choice,6,1734531287481,undefined,У нас всех сегодня очень интересные доклады.,vse,R,high,False,NULL
1734531454,5d0ae46a3921b8a231566119af0b8362,PennController,9,0,experiment,NULL,Scale,judgement,Choice,5,1734531294646,undefined,Я каждый раз прошу помощи у него у уставшего.,depic,R,low,True,NULL
1734531454,5d0ae46a3921b8a231566119af0b8362,PennController,31,0,experiment,NULL,Scale,judgement,Choice,1,1734531299332,undefined,У каждого нас сегодня есть чем поделиться.,kazhdy,L,high,False,NULL
1734531454,5d0ae46a3921b8a231566119af0b8362,PennController,33,0,experiment,NULL,Scale,judgement,Choice,4,1734531303935,undefined,И у пьяного тебя иногда отлично голова работает.,depic,L,high,False,NULL
1734531454,5d0ae46a3921b8a231566119af0b8362,PennController,18,0,experiment,NULL,Scale,judgement,Choice,4,1734531314222,undefined,Он одолжил у них денег у всех.,vse,E,low,True,NULL
1734531454,5d0ae46a3921b8a231566119af0b8362,PennController,2,0,experiment,NULL,Scale,judgement,Choice,7,1734531317686,undefined,У нас у всех недавно произошло трагическое событие.,vse,R,high,True,NULL
1734531454,5d0ae46a3921b8a231566119af0b8362,PennController,28,0,experiment,NULL,Scale,judgement,Choice,7,1734531321316,undefined,Я узнал все детали у нее самой.,sam,R,low,False,NULL
1734531454,5d0ae46a3921b8a231566119af0b8362,PennController,17,0,experiment,NULL,Scale,judgement,Choice,6,1734531325819,undefined,У него часто и у больного получается лучше%2C чем других.,depic,E,high,True,NULL
1734531454,5d0ae46a3921b8a231566119af0b8362,PennController,32,0,experiment,NULL,Scale,judgement,Choice,3,1734531332001,undefined,У самого него теперь почти нет денег.,sam,L,high,False,NULL
1734531454,5d0ae46a3921b8a231566119af0b8362,PennController,14,0,experiment,NULL,Scale,judgement,Choice,7,1734531336180,undefined,У нас недавно у всех произошло трагическое событие.,vse,E,high,True,NULL
1734531454,5d0ae46a3921b8a231566119af0b8362,PennController,34,0,experiment,NULL,Scale,judgement,Choice,2,1734531340632,undefined,У нас сегодня всех очень интересные доклады.,vse,E,high,False,NULL
1734531454,5d0ae46a3921b8a231566119af0b8362,PennController,29,0,experiment,NULL,Scale,judgement,Choice,3,1734531347908,undefined,Я никогда раньше не был у него больного.,depic,R,low,False,NULL
1734531454,5d0ae46a3921b8a231566119af0b8362,PennController,21,0,experiment,NULL,Scale,judgement,Choice,2,1734531352255,undefined,Я каждый раз прошу у него помощи у уставшего.,depic,E,low,True,NULL
1734531454,5d0ae46a3921b8a231566119af0b8362,PennController,10,0,experiment,NULL,Scale,judgement,Choice,6,1734531356304,undefined,У всех у нас недавно произошло трагическое событие.,vse,L,high,True,NULL
1734531454,5d0ae46a3921b8a231566119af0b8362,PennController,15,0,experiment,NULL,Scale,judgement,Choice,7,1734531359099,undefined,У них небось у каждого по куче денег.,kazhdy,E,high,True,NULL
1734531454,5d0ae46a3921b8a231566119af0b8362,PennController,38,0,experiment,NULL,Scale,judgement,Choice,1,1734531362676,undefined,Мы у них уже бывали в гостях всех.,vse,E,low,False,NULL
1734531454,5d0ae46a3921b8a231566119af0b8362,PennController,37,0,experiment,NULL,Scale,judgement,Choice,2,1734531366466,undefined,У тебя иногда и пьяного отлично голова работает.,depic,E,high,False,NULL
1734531454,5d0ae46a3921b8a231566119af0b8362,PennController,8,0,experiment,NULL,Scale,judgement,Choice,5,1734531373783,undefined,Она мечтала обо всем спросить у него у самого.,sam,R,low,True,NULL
1734531454,5d0ae46a3921b8a231566119af0b8362,PennController,16,0,experiment,NULL,Scale,judgement,Choice,7,1734531377854,undefined,У меня сейчас у самого возникли вопросы к организаторам этого мероприятия.,sam,E,high,True,NULL
1734531454,5d0ae46a3921b8a231566119af0b8362,PennController,24,0,experiment,NULL,Scale,judgement,Choice,7,1734531381634,undefined,У него самого теперь почти нет денег.,sam,R,high,False,NULL
1734531454,5d0ae46a3921b8a231566119af0b8362,PennController,6,0,experiment,NULL,Scale,judgement,Choice,7,1734531384507,undefined,Он одолжил денег у них у всех.,vse,R,low,True,NULL
1734531454,5d0ae46a3921b8a231566119af0b8362,PennController,4,0,experiment,NULL,Scale,judgement,Choice,7,1734531392774,undefined,У меня у самого сейчас возникли вопросы к организаторам этого мероприятия.,sam,R,high,True,NULL
1734531454,5d0ae46a3921b8a231566119af0b8362,PennController,5,0,experiment,NULL,Scale,judgement,Choice,1,1734531399355,undefined,У него и у больного часто получается лучше%2C чем других.,depic,R,high,True,NULL
1734531454,5d0ae46a3921b8a231566119af0b8362,PennController,20,0,experiment,NULL,Scale,judgement,Choice,3,1734531408443,undefined,Она мечтала у него обо всем спросить у самого.,sam,E,low,True,NULL
1734531454,5d0ae46a3921b8a231566119af0b8362,PennController,36,0,experiment,NULL,Scale,judgement,Choice,4,1734531414900,undefined,У него теперь самого почти нет денег.,sam,E,high,False,NULL
1734531454,5d0ae46a3921b8a231566119af0b8362,PennController,23,0,experiment,NULL,Scale,judgement,Choice,2,1734531418664,undefined,У нас каждого сегодня есть чем поделиться.,kazhdy,R,high,False,NULL
1734531454,5d0ae46a3921b8a231566119af0b8362,PennController,35,0,experiment,NULL,Scale,judgement,Choice,1,1734531421259,undefined,У нас сегодня каждого есть чем поделиться.,kazhdy,E,high,False,NULL
1734531454,5d0ae46a3921b8a231566119af0b8362,PennController,7,0,experiment,NULL,Scale,judgement,Choice,6,1734531426233,undefined,Она проверила домашнее задание у нас у каждого.,kazhdy,R,low,True,NULL
1734531454,5d0ae46a3921b8a231566119af0b8362,PennController,25,0,experiment,NULL,Scale,judgement,Choice,2,1734531430065,undefined,У тебя и пьяного иногда отлично голова работает.,depic,R,high,False,NULL
1734531454,5d0ae46a3921b8a231566119af0b8362,PennController,19,0,experiment,NULL,Scale,judgement,Choice,4,1734531433591,undefined,Она проверила у нас домашнее задание у каждого.,kazhdy,E,low,True,NULL
1734531454,5d0ae46a3921b8a231566119af0b8362,PennController,3,0,experiment,NULL,Scale,judgement,Choice,7,1734531436371,undefined,У них у каждого небось по куче денег.,kazhdy,R,high,True,NULL
1734531454,5d0ae46a3921b8a231566119af0b8362,PennController,12,0,experiment,NULL,Scale,judgement,Choice,5,1734531446203,undefined,У самого у меня сейчас возникли вопросы к организаторам этого мероприятия.,sam,L,high,True,NULL
1734531454,5d0ae46a3921b8a231566119af0b8362,PennController,11,0,experiment,NULL,Scale,judgement,Choice,3,1734531450618,undefined,У каждого у них небось по куче денег.,kazhdy,L,high,True,NULL
1734531454,5d0ae46a3921b8a231566119af0b8362,PennController,41,0,experiment,NULL,Scale,judgement,Choice,2,1734531454669,undefined,Я у него никогда раньше не был больного.,depic,E,low,False,NULL
1734531454,5d0ae46a3921b8a231566119af0b8362,PennController,39,0,experiment,NULL,Scale,judgement,Choice,1,1734531458460,undefined,Не волнуйся%2C он у нас это спрашивал каждого.,kazhdy,E,low,False,NULL
1734531454,5d0ae46a3921b8a231566119af0b8362,PennController,30,0,experiment,NULL,Scale,judgement,Choice,6,1734531464961,undefined,У всех нас сегодня очень интересные доклады.,vse,L,high,False,NULL
1734531454,5d0ae46a3921b8a231566119af0b8362,PennController,40,0,experiment,NULL,Scale,judgement,Choice,1,1734531469613,undefined,Я узнал у нее все детали самой.,sam,E,low,False,NULL
1734531471,21d5aa80de8862c2cb731a503d176d0b,PennController,21,0,experiment,NULL,Scale,judgement,Choice,4,1734531207917,undefined,Я у него никогда раньше не был у больного.,depic,E,low,True,NULL
1734531471,21d5aa80de8862c2cb731a503d176d0b,PennController,23,0,experiment,NULL,Scale,judgement,Choice,1,1734531213667,undefined,У них каждого небось по куче денег.,kazhdy,R,high,False,NULL
1734531471,21d5aa80de8862c2cb731a503d176d0b,PennController,26,0,experiment,NULL,Scale,judgement,Choice,5,1734531216717,undefined,Он одолжил денег у них всех.,vse,R,low,False,NULL
1734531471,21d5aa80de8862c2cb731a503d176d0b,PennController,29,0,experiment,NULL,Scale,judgement,Choice,2,1734531259667,undefined,Я каждый раз прошу помощи у него уставшего.,depic,R,low,False,NULL
1734531471,21d5aa80de8862c2cb731a503d176d0b,PennController,13,0,experiment,NULL,Scale,judgement,Choice,6,1734531265701,undefined,И у пьяного у тебя иногда отлично голова работает.,depic,L,high,True,NULL
1734531471,21d5aa80de8862c2cb731a503d176d0b,PennController,2,0,experiment,NULL,Scale,judgement,Choice,7,1734531270917,undefined,У нас у всех сегодня очень интересные доклады.,vse,R,high,True,NULL
1734531471,21d5aa80de8862c2cb731a503d176d0b,PennController,41,0,experiment,NULL,Scale,judgement,Choice,1,1734531273902,undefined,Я каждый раз прошу у него помощи уставшего.,depic,E,low,False,NULL
1734531471,21d5aa80de8862c2cb731a503d176d0b,PennController,17,0,experiment,NULL,Scale,judgement,Choice,7,1734531277568,undefined,У тебя иногда и у пьяного отлично голова работает.,depic,E,high,True,NULL
1734531471,21d5aa80de8862c2cb731a503d176d0b,PennController,34,0,experiment,NULL,Scale,judgement,Choice,2,1734531282253,undefined,У нас недавно всех произошло трагическое событие.,vse,E,high,False,NULL
1734531471,21d5aa80de8862c2cb731a503d176d0b,PennController,27,0,experiment,NULL,Scale,judgement,Choice,1,1734531284602,undefined,Она проверила домашнее задание у нас каждого.,kazhdy,R,low,False,NULL
1734531471,21d5aa80de8862c2cb731a503d176d0b,PennController,22,0,experiment,NULL,Scale,judgement,Choice,4,1734531293001,undefined,У нас всех недавно произошло трагическое событие.,vse,R,high,False,NULL
1734531471,21d5aa80de8862c2cb731a503d176d0b,PennController,20,0,experiment,NULL,Scale,judgement,Choice,2,1734531298416,undefined,Я узнал у нее все детали у самой.,sam,E,low,True,NULL
1734531471,21d5aa80de8862c2cb731a503d176d0b,PennController,28,0,experiment,NULL,Scale,judgement,Choice,3,1734531309367,undefined,Она мечтала обо всем спросить у него самого.,sam,R,low,False,NULL
1734531471,21d5aa80de8862c2cb731a503d176d0b,PennController,6,0,experiment,NULL,Scale,judgement,Choice,6,1734531312551,undefined,Мы уже бывали в гостях у них у всех.,vse,R,low,True,NULL
1734531471,21d5aa80de8862c2cb731a503d176d0b,PennController,33,0,experiment,NULL,Scale,judgement,Choice,2,1734531318619,undefined,И у больного него часто получается лучше%2C чем других.,depic,L,high,False,NULL
1734531471,21d5aa80de8862c2cb731a503d176d0b,PennController,3,0,experiment,NULL,Scale,judgement,Choice,7,1734531323984,undefined,У нас у каждого сегодня есть чем поделиться.,kazhdy,R,high,True,NULL
1734531471,21d5aa80de8862c2cb731a503d176d0b,PennController,11,0,experiment,NULL,Scale,judgement,Choice,5,1734531325952,undefined,У каждого у нас сегодня есть чем поделиться.,kazhdy,L,high,True,NULL
1734531471,21d5aa80de8862c2cb731a503d176d0b,PennController,19,0,experiment,NULL,Scale,judgement,Choice,6,1734531329986,undefined,Не волнуйся%2C он у нас это спрашивал у каждого.,kazhdy,E,low,True,NULL
1734531471,21d5aa80de8862c2cb731a503d176d0b,PennController,37,0,experiment,NULL,Scale,judgement,Choice,1,1734531335817,undefined,У него часто и больного получается лучше%2C чем других.,depic,E,high,False,NULL
1734531471,21d5aa80de8862c2cb731a503d176d0b,PennController,4,0,experiment,NULL,Scale,judgement,Choice,3,1734531343135,undefined,У него у самого теперь почти нет денег.,sam,R,high,True,NULL
1734531471,21d5aa80de8862c2cb731a503d176d0b,PennController,5,0,experiment,NULL,Scale,judgement,Choice,7,1734531345166,undefined,У тебя и у пьяного иногда отлично голова работает.,depic,R,high,True,NULL
1734531471,21d5aa80de8862c2cb731a503d176d0b,PennController,30,0,experiment,NULL,Scale,judgement,Choice,5,1734531349734,undefined,У всех нас недавно произошло трагическое событие.,vse,L,high,False,NULL
1734531471,21d5aa80de8862c2cb731a503d176d0b,PennController,36,0,experiment,NULL,Scale,judgement,Choice,1,1734531354035,undefined,У меня сейчас самого возникли вопросы к организаторам этого мероприятия.,sam,E,high,False,NULL
1734531471,21d5aa80de8862c2cb731a503d176d0b,PennController,40,0,experiment,NULL,Scale,judgement,Choice,1,1734531359352,undefined,Она мечтала у него обо всем спросить самого.,sam,E,low,False,NULL
1734531471,21d5aa80de8862c2cb731a503d176d0b,PennController,38,0,experiment,NULL,Scale,judgement,Choice,1,1734531362037,undefined,Он одолжил у них денег всех.,vse,E,low,False,NULL
1734531471,21d5aa80de8862c2cb731a503d176d0b,PennController,32,0,experiment,NULL,Scale,judgement,Choice,1,1734531370218,undefined,У самого меня сейчас возникли вопросы к организаторам этого мероприятия.,sam,L,high,False,NULL
1734531471,21d5aa80de8862c2cb731a503d176d0b,PennController,25,0,experiment,NULL,Scale,judgement,Choice,1,1734531372469,undefined,У него и больного часто получается лучше%2C чем других.,depic,R,high,False,NULL
1734531471,21d5aa80de8862c2cb731a503d176d0b,PennController,15,0,experiment,NULL,Scale,judgement,Choice,7,1734531374801,undefined,У нас сегодня у каждого есть чем поделиться.,kazhdy,E,high,True,NULL
1734531471,21d5aa80de8862c2cb731a503d176d0b,PennController,18,0,experiment,NULL,Scale,judgement,Choice,4,1734531380069,undefined,Мы у них уже бывали в гостях у всех.,vse,E,low,True,NULL
1734531471,21d5aa80de8862c2cb731a503d176d0b,PennController,9,0,experiment,NULL,Scale,judgement,Choice,2,1734531383303,undefined,Я никогда раньше не был у него у больного.,depic,R,low,True,NULL
1734531471,21d5aa80de8862c2cb731a503d176d0b,PennController,39,0,experiment,NULL,Scale,judgement,Choice,1,1734531386252,undefined,Она проверила у нас домашнее задание каждого.,kazhdy,E,low,False,NULL
1734531471,21d5aa80de8862c2cb731a503d176d0b,PennController,14,0,experiment,NULL,Scale,judgement,Choice,6,1734531390101,undefined,У нас сегодня у всех очень интересные доклады.,vse,E,high,True,NULL
1734531471,21d5aa80de8862c2cb731a503d176d0b,PennController,10,0,experiment,NULL,Scale,judgement,Choice,6,1734531393869,undefined,У всех у нас сегодня очень интересные доклады.,vse,L,high,True,NULL
1734531471,21d5aa80de8862c2cb731a503d176d0b,PennController,8,0,experiment,NULL,Scale,judgement,Choice,1,1734531396969,undefined,Я узнал все детали у нее у самой.,sam,R,low,True,NULL
1734531471,21d5aa80de8862c2cb731a503d176d0b,PennController,24,0,experiment,NULL,Scale,judgement,Choice,1,1734531452451,undefined,У меня самого сейчас возникли вопросы к организаторам этого мероприятия.,sam,R,high,False,NULL
1734531471,21d5aa80de8862c2cb731a503d176d0b,PennController,31,0,experiment,NULL,Scale,judgement,Choice,1,1734531454885,undefined,У каждого них небось по куче денег.,kazhdy,L,high,False,NULL
1734531471,21d5aa80de8862c2cb731a503d176d0b,PennController,12,0,experiment,NULL,Scale,judgement,Choice,1,1734531460152,undefined,У самого у него теперь почти нет денег.,sam,L,high,True,NULL
1734531471,21d5aa80de8862c2cb731a503d176d0b,PennController,35,0,experiment,NULL,Scale,judgement,Choice,1,1734531462119,undefined,У них небось каждого по куче денег.,kazhdy,E,high,False,NULL
1734531471,21d5aa80de8862c2cb731a503d176d0b,PennController,16,0,experiment,NULL,Scale,judgement,Choice,5,1734531465036,undefined,У него теперь у самого почти нет денег.,sam,E,high,True,NULL
1734531471,21d5aa80de8862c2cb731a503d176d0b,PennController,7,0,experiment,NULL,Scale,judgement,Choice,6,1734531468352,undefined,Не волнуйся%2C он это спрашивал у нас у каждого.,kazhdy,R,low,True,NULL
1734531995,2d1dbfbe79f1dea9441c43d98f194a94,PennController,16,0,experiment,NULL,Scale,judgement,Choice,7,1734531794756,undefined,У него теперь у самого почти нет денег.,sam,E,high,True,NULL
1734531995,2d1dbfbe79f1dea9441c43d98f194a94,PennController,21,0,experiment,NULL,Scale,judgement,Choice,7,1734531798352,undefined,Я у него никогда раньше не был у больного.,depic,E,low,True,NULL
1734531995,2d1dbfbe79f1dea9441c43d98f194a94,PennController,28,0,experiment,NULL,Scale,judgement,Choice,7,1734531800737,undefined,Она мечтала обо всем спросить у него самого.,sam,R,low,False,NULL
1734531995,2d1dbfbe79f1dea9441c43d98f194a94,PennController,11,0,experiment,NULL,Scale,judgement,Choice,5,1734531805441,undefined,У каждого у нас сегодня есть чем поделиться.,kazhdy,L,high,True,NULL
1734531995,2d1dbfbe79f1dea9441c43d98f194a94,PennController,37,0,experiment,NULL,Scale,judgement,Choice,4,1734531811030,undefined,У него часто и больного получается лучше%2C чем других.,depic,E,high,False,NULL
1734531995,2d1dbfbe79f1dea9441c43d98f194a94,PennController,34,0,experiment,NULL,Scale,judgement,Choice,6,1734531828945,undefined,У нас недавно всех произошло трагическое событие.,vse,E,high,False,NULL
1734531995,2d1dbfbe79f1dea9441c43d98f194a94,PennController,29,0,experiment,NULL,Scale,judgement,Choice,7,1734531843641,undefined,Я каждый раз прошу помощи у него уставшего.,depic,R,low,False,NULL
1734531995,2d1dbfbe79f1dea9441c43d98f194a94,PennController,18,0,experiment,NULL,Scale,judgement,Choice,7,1734531848226,undefined,Мы у них уже бывали в гостях у всех.,vse,E,low,True,NULL
1734531995,2d1dbfbe79f1dea9441c43d98f194a94,PennController,19,0,experiment,NULL,Scale,judgement,Choice,7,1734531857021,undefined,Не волнуйся%2C он у нас это спрашивал у каждого.,kazhdy,E,low,True,NULL
1734531995,2d1dbfbe79f1dea9441c43d98f194a94,PennController,17,0,experiment,NULL,Scale,judgement,Choice,7,1734531883407,undefined,У тебя иногда и у пьяного отлично голова работает.,depic,E,high,True,NULL
